{
  "$schema": "../schemas/agent-v1.schema.json",
  "formatVersion": 1,
  "contractStatus": "runtime-ready",
  "id": "implementer",
  "upstreamAgentId": "omp-implementer",
  "version": "1.2.0",
  "description": "Single managed-clone writer that implements an approved plan and reports exact changes for parent verification.",
  "prompt": { "file": "agents/prompts/implementer.md" },
  "tools": {
    "allow": ["read", "grep", "find", "ls", "edit", "write", "bash"],
    "deny": ["web"]
  },
  "allowedExecutionStates": ["build"],
  "requiredCapabilities": ["workspace-read", "file-tool-policy", "bash-sandbox-conditional"],
  "policyCeiling": {
    "workspace": "worktree-write",
    "egress": { "web": "deny", "mcp": "deny", "provider": "inherit", "extension": "deny" },
    "approval": "ask",
    "mutation": "isolated-worktree"
  },
  "modelRole": "balanced",
  "inputSchema": {
    "type": "object",
    "additionalProperties": false,
    "properties": { "plan": { "type": "object", "description": "Approved structured plan." }, "scope": { "type": "array", "description": "Allowed repository-relative paths." } },
    "required": ["plan", "scope"]
  },
  "outputSchema": {
    "type": "object",
    "additionalProperties": false,
    "properties": {
      "status": { "type": "string", "description": "Implementation status." },
      "changedPaths": { "type": "array", "description": "Changed repository-relative paths." },
      "summary": { "type": "string", "description": "Bounded change summary." },
      "verification": { "type": "array", "description": "Verification commands actually run and their outcomes." },
      "followUp": { "type": "array", "description": "Remaining verification work." }
    },
    "required": ["status", "changedPaths", "summary", "verification", "followUp"]
  },
  "writer": true,
  "timeoutSeconds": 1800,
  "continuable": true,
  "resumable": true,
  "redaction": { "rawPrompts": "omit", "reasoning": "omit", "credentials": "deny", "maxOutputBytes": 65536 },
  "gateIds": ["diff-check"]
}
